{"type":"config","name":"llm-ac-policy","metricName":"compliance_score","metricUnit":"%","bestDirection":"higher"}
{"run":1,"commit":"d209a86","metric":91,"metrics":{"label_rate":72,"policy_lines":198},"status":"keep","description":"baseline","timestamp":1776675727,"segment":0}
{"run":2,"commit":"d209a86","metric":82,"metrics":{"label_rate":88,"policy_lines":166},"status":"discard","description":"move ALWAYS to top + reduce rules 18→10 + strengthen verification","timestamp":1776678351,"segment":0}
{"run":3,"commit":"d209a86","metric":83,"metrics":{"label_rate":88,"policy_lines":201},"status":"discard","description":"move full ALWAYS (18 rules) to top + verification wording","timestamp":1776678862,"segment":0}
{"run":4,"commit":"d209a86","metric":80,"metrics":{"label_rate":77,"policy_lines":202},"status":"discard","description":"add 4th core principle (label everything) + verification example","timestamp":1776679521,"segment":0}
{"type":"config","name":"llm-ac-policy-fixed-t6","metricName":"compliance_score","metricUnit":"%","bestDirection":"higher"}
{"run":5,"commit":"d209a86","metric":99,"metrics":{"label_rate":94,"policy_lines":198},"status":"keep","description":"corrected baseline (fixed T6 detection - Korean terms + symbols)","timestamp":1776680283,"segment":1}
{"run":6,"commit":"d209a86","metric":91,"metrics":{"label_rate":77,"policy_lines":198},"status":"keep","description":"confirmation run 1 (same policy)","timestamp":1776681447,"segment":1}
{"run":7,"commit":"d209a86","metric":85,"metrics":{"label_rate":77,"policy_lines":198},"status":"keep","description":"confirmation run 2 (same policy, shows high variance)","timestamp":1776681447,"segment":1}
{"run":8,"commit":"d209a86","metric":83,"metrics":{"label_rate":94,"policy_lines":198},"status":"discard","description":"add COUNT items to before-work checklist","timestamp":1776681985,"segment":1}
{"type":"config","name":"llm-ac-round2-sonnet","metricName":"compliance_score","metricUnit":"%","bestDirection":"higher"}
{"run":9,"commit":"8ce18d9","metric":72,"metrics":{"label_rate":76,"policy_lines":198,"hard_fails":4},"status":"keep","description":"Round 2 baseline (Sonnet N=5, redesigned harness)","timestamp":1776684670,"segment":2}
{"run":10,"commit":"b9c5a38","metric":72,"metrics":{"label_rate":83,"policy_lines":218,"hard_fails":5},"status":"discard","description":"add COMPLETE/PARTIAL rule + Verification Standards + no sycophancy","timestamp":1776686442,"segment":2}
{"run":11,"commit":"b9c5a38","metric":74,"metrics":{"label_rate":66,"policy_lines":208,"hard_fails":5},"status":"discard","description":"STOP-CHECK metacognitive protocol (4 self-questions before labeling)","timestamp":1776689805,"segment":2}
{"run":12,"commit":"842c775","metric":74,"metrics":{"label_rate":76,"policy_lines":214,"hard_fails":5},"status":"keep","description":"Layer 1 (few-shot examples) + Layer 6 (stop hook) + Layer 2 (context-aware reminder)","timestamp":1776692708,"segment":2}
{"run":13,"commit":"9961572","metric":72,"metrics":{"label_rate":83,"policy_lines":198,"hard_fails":5},"status":"discard","description":"per-task derivation + reproduction obligation + dedup (Opus/Codex recs)","timestamp":1776696710,"segment":2}
